{
  "channel_id": "55555555-5555-4555-8555-555555555555",
  "workspace_id": "11111111-1111-4111-8111-111111111111",
  "platform": "youtube",
  "external_account_id": null,
  "display_name": null,
  "state": "not_connected",
  "provider_removal_state": "not_applicable",
  "granted_scopes": [],
  "capabilities": { "publish": "not_available", "schedule": "not_available" },
  "authorized_at": null,
  "refreshed_at": null,
  "denied_at": null
}
